text,s_palak_label,s_ben_label
"This would be the best case scenario, Wednesday the 6th of January 2021 would be almost equally good. Both strongly rooted in the constitution NOT a coup. Why anyone wouldn't want our election process to be secure and legitimate is beyond me. Pure ""win at any cost"" politics.",NEUTRAL,NEUTRAL
Another great video,OPINIONATED,OPINIONATED
"My wife and I had the same argument last night. She called the people that stormed the building appalling. I was like what was appalling was people who rioted, attacked older people for wearing trump hats, and destroyed property of people who had nothing to do with anything that was going on who were trying to make a living.",OPINIONATED,NEUTRAL
...Senate chamber. Brain fart,OPINIONATED,OPINIONATED
HERES YOUR PROOF NEWS MEDIA... YOU ARE WELCOME FOR US DOING YOUR JOBS!!!!,OPINIONATED,OPINIONATED
"Don't worry, GITMO is waiting for him for his TREASON as well...",NEUTRAL,NEUTRAL
"Bastards they have known all along....they say it now cuss I believe they just could no longer keep it secret from the public! personally i've known this for months and have been so upset that it was not talked about enough....like how can you kill the economy of the world based on a faulty test...it makes no sense and we are still being locked down....All politicians and Health groups have know about this. PRC test was approved 2 days after its release and never really peer reviewed and the designer of this test did not approve it for covid19 testing....crime against humanity....maybe afraid of being arrested, sued?...",OPINIONATED,OPINIONATED
Great job,OPINIONATED,OPINIONATED
"Bill, it stops now or it never will.",NEUTRAL,OPINIONATED
1st Communist Senator From Georgia,NEUTRAL,NEUTRAL
I tried to tell you......they are NOT your friends.,OPINIONATED,NEUTRAL
We want a fair election,NEUTRAL,NEUTRAL
"Also, Trump is a behind.",OPINIONATED,OPINIONATED
"My faith is strong! I know whatever happens, that God is in control!! That gives me peace like non other!!",OPINIONATED,OPINIONATED
THE RIGHT TO VOTE | Great Reset | Sidney Powell | ?,NEUTRAL,NEUTRAL
The video on YouTube says it all.,NEUTRAL,NEUTRAL
Simply true,OPINIONATED,OPINIONATED
"Meanwhile:Here is another lawsuit filed against Gov. Kate Brown for her lawless COVID overreach. “Lindsey Graham, the owner of Glamour Salon in Salem, Oregon, filed suit in federal court on Thursday against Governor Kate Brown (D-Portland), the State of Oregon, and the multitude of state agencies Brown sicced on her. Graham reopened her business in May in defiance of Brown’s coronavirus lockdown orders & soon found herself the target of coordinated harassment by the state.Brown declared a state of emergency in March in the face of the CCP coronavirus pandemic & ordered all non-essential businesses, churches, and schools closed.In an interview with PJ Media, Graham discussed the reason for her lawsuit. ‘I can’t back down now,’ she said. ‘I’ve had so many donations to the foundation & I wanted to show others that we need to stand up & fight back. Hopefully this gives other people the courage and bravery to stand up against these orders.”#projectfightback #fightbackoregon",NEUTRAL,NEUTRAL
Way to go !!!! Beautiful day in the neighborhood 🇺🇸🇺🇸🇺🇸🇺🇸,OPINIONATED,OPINIONATED
Did Trump just say he’s not hearing good things about Pence!? 🧐,OPINIONATED,OPINIONATED
TRUMP ATTACKED PENCE: HE DID NOT HAVE THE COURAGE TO DO WHAT WAS NECESSARY TO PROTECT OUR COUNTRY,OPINIONATED,NEUTRAL
"That bitch from California claims the will of the people is being subverted. Wrong!! The will of their machines and fake ballots, dead, out of state, illegal and underage voters voted! This is NOT the will of the people!",OPINIONATED,OPINIONATED
"DC police pulls down Trump busses and inspects people like they are some criminals. Echo to raise the alarm, follow me for updates",NEUTRAL,NEUTRAL
Traitor....,OPINIONATED,OPINIONATED
This is Antifa right? Not what we talked here on parler and now many of you run like cowards,OPINIONATED,OPINIONATED
The best,OPINIONATED,OPINIONATED
Thank God. Senator Kennedy of Louisiana. I am Proud to be from Louisiana.,OPINIONATED,OPINIONATED
Yes We need to keep repeating this truth,NEUTRAL,NEUTRAL
Well done patriots. Follow me if you love all these photos and to see more,OPINIONATED,OPINIONATED
"Hi <a href=""/profile/Z177345/posts"" class=""at"">@Z177345</a>, Good to see your posts on Parler. I just UPVOTED your latest written Parley post. Just got my Trump coin. I love it! I recommend it to every proud Patriot! The first one is free! Click the link in my BIO take care",OPINIONATED,OPINIONATED
Would be a shame if their tires went flat.🎯😉🇺🇸🗽,OPINIONATED,NEUTRAL
#fuckantifa#fakepatriot,NEUTRAL,OPINIONATED
"Patrick Byrne (@PatrickByrne) Tweeted:Signed,Patrick M Byrne (Journalist, )",NEUTRAL,NEUTRAL
Bullets are soon to fly . Fly your flags upside down,NEUTRAL,NEUTRAL
I'm on board,OPINIONATED,OPINIONATED
American CEOs will focus on corporate tax rates under Biden administration: Former Home Depot CEO ||Mornings with Maria 6-9 AM et M-F on Fox Business,NEUTRAL,NEUTRAL
"For those of you not Catholics, this is the Divine Mercy chaplet. This is a very powerful prayer.",OPINIONATED,OPINIONATED
Newsmax just cut off one of their reporters on the ground in DC because he was saying that he agrees with what the crowds are doing.Newsmax is just as fake as the rest of them.They're trying to control what you see!,OPINIONATED,OPINIONATED
My thoughts and Prayers go to Ashley and her Family! We will take it from her my Sister! God Bless!,OPINIONATED,OPINIONATED
"Can it get any clearer? Does this sound like Patriots? Really?Give me a break. My money is on ""Let's Wait To See Who They Really Are!""",OPINIONATED,OPINIONATED
"Yo Mayor, did you see this?How come there are cement blocks in garbage bags on the street??? What cha planning you deep state useful idiot...who’s pulling your strings?????",OPINIONATED,OPINIONATED
Pathetic!,OPINIONATED,OPINIONATED
If this was BLM they would have evacuated and let them trash it and burn it to the ground. Thats the difference.,OPINIONATED,OPINIONATED
Good job catching this,OPINIONATED,OPINIONATED
Lin Wood can NOT be trusted.,OPINIONATED,OPINIONATED
"Facebook took this video of President Trump telling people to leave the Capitol to go home. Twitter deleted the video AND suspended President Trumps account from posting, i forget how long the suspension is for. As soon as Trump sent this video out, people started to leave, as he asked. Wonder why Facebook/Twitter took the video down.",NEUTRAL,OPINIONATED
Elijah is pissing his pants! Not a drill. LOL,NEUTRAL,OPINIONATED
Way to go!,OPINIONATED,OPINIONATED
Words fail me,OPINIONATED,OPINIONATED
That picture may actually happen! Jesus is coming soon❤️,NEUTRAL,NEUTRAL
CHEAPSKATE FLIES COMMERCIAL,OPINIONATED,NEUTRAL
Snd the CIA Both need to be deleted and rebuilt from the top down. The head of each are spoiled.,OPINIONATED,OPINIONATED
NOPE..THE STREETS ARE GOING TO RUN RED,NEUTRAL,OPINIONATED
"Professional, successful, educated, bright mind , fresh start 2021❤️❤️🇺🇸🇺🇸🇺🇸🙏🙏🙏",OPINIONATED,OPINIONATED
We need a John Galt more than ever. Someone needs to write a manifesto ASAP for us to follow. Feel like 1984 is becoming a reality and Atlas Shrugged theory is a dream of the future with a John Galt figure being whispered about. Where is he?,NEUTRAL,NEUTRAL
Same old same’O mess! 😡🇺🇸🇺🇸🇺🇸🇺🇸🇺🇸🇺🇸🇺🇸,OPINIONATED,OPINIONATED
MSNBC saying that were attacking the police officers were tearing down to the Capitol Building bombs going off this is how pathetic they are,OPINIONATED,OPINIONATED
It’s redder than Florida and assoff and warnock are further left than AOC. It strains credulity.,OPINIONATED,OPINIONATED
I think you got on the WRONG plane Mitt!,OPINIONATED,OPINIONATED
"a href=""/profile/LauraIngraham/posts"" class=""at"">@LauraIngraham</a> YOU HAVE THE BEST TVSHOW EVER SEEN ON TONIGHT IS ALWAYS SO VERY GOOD AND THE GUESTS ARE SO VERY AWESOME. #INGRAHAM #TRUMP2020 #MAGA2020 #KAG2020#USA2020",OPINIONATED,OPINIONATED
So true!TRUMP2020!🇺🇸🇺🇸🇺🇸,OPINIONATED,OPINIONATED
Keep the faith!,OPINIONATED,OPINIONATED
Lauren Boebert (@laurenboebert) Tweeted:Today is 1776.,NEUTRAL,NEUTRAL
Failure To Contain Big Tech Is The Biggest Failure Of 2020 | ZeroHedge,OPINIONATED,OPINIONATED
"This is bad and sad 😔 because of that bastard Mike Pence #mikepence Someone will die <a href=""/profile/Simonlaur76/posts"" class=""at"">@Simonlaur76</a> <a href=""/profile/CommunistsDeserveToDie/posts"" class=""at"">@CommunistsDeserveToDie</a> 🇺🇸🇺🇸🇺🇸🇺🇸🇺🇸🇺🇸🇺🇸",OPINIONATED,OPINIONATED
YOU DON'T JUST STOP COUNTING VOTES. THIS IS NOT ACCEPTABLE IN AMERICA!!!!!!,OPINIONATED,OPINIONATED
Thats funny stuff! 😂😂,OPINIONATED,OPINIONATED
I am ready here. Bring it,OPINIONATED,OPINIONATED
George soros looks happy about the current situation.....,OPINIONATED,OPINIONATED
YES ALL CHINA-TIED STORES AS THESE ARE!!,NEUTRAL,NEUTRAL
CORRECT.,OPINIONATED,OPINIONATED
MATT IS A TRUE AMERICAN PATRIOT!!!,OPINIONATED,OPINIONATED
He deserves NO support from any New Yorker!,OPINIONATED,OPINIONATED
Big round of applause for all our patriot brothers and sisters! Love you all for what you are doing and wish I could be there with you in DC. Just please be careful and ask for the Lord’s blessing before engaging the enemy.,OPINIONATED,OPINIONATED
"Every <a href=""/profile/GOP/posts"" class=""at"">@GOP</a> politician is a useless empty suit that doesn’t give a damn about their constituents or this country. Defund <a href=""/profile/GOP/posts"" class=""at"">@GOP</a> please <a href=""/profile/RealRLimbaugh/posts"" class=""at"">@RealRLimbaugh</a",OPINIONATED,OPINIONATED
Thank You Marjorie Taylor Greene!!!,OPINIONATED,OPINIONATED
BULLSHIT! 🇺🇸🇺🇸🇺🇸,OPINIONATED,OPINIONATED
"The American system of government is totally inadequate to the task—and it’s getting worse every year, with an immoral populace and seditious elected representatives. If you begged, maybe some European country would let you have a monarch, idk.",OPINIONATED,OPINIONATED
"a href=""/profile/realLindseyGrahamSC/posts"" class=""at"">@realLindseyGrahamSC</a> spineless",OPINIONATED,OPINIONATED
"This is so terrible. Something has got to happen to save america. This is way too suspicious to be accurate. The liberals aren’t that smart to organize without evil outside help. God, please help us!",OPINIONATED,OPINIONATED
REPORT: Pence’s Chief Of Staff Marc Short Says He Was Denied Entry Back Into The White House | The Daily Caller,NEUTRAL,OPINIONATED
#BigTechCensorship #FakeNews #MediaBias #VoterFraud #FarLeftTrump Knocked Off Twitter for 12 Hours and May Be BANNED! Where Do We Go From Here?,OPINIONATED,OPINIONATED
You’re right it is a double standard,OPINIONATED,OPINIONATED
Right on!,OPINIONATED,OPINIONATED
Awesome!❤️🙏❤️🙏❤️,OPINIONATED,OPINIONATED
Fantastic!,OPINIONATED,OPINIONATED
Re-posting these stats from a Doctor. They do NOT want you to know about the Covid recovery statistics.,OPINIONATED,OPINIONATED
Unbelievable... blocking a peaceful message.,OPINIONATED,NEUTRAL
True Story,OPINIONATED,OPINIONATED
That didn’t really work so far. It seems like it’s all going to blow up like a big powder keg tomorrow! 🔥🔥🔥,OPINIONATED,OPINIONATED
"🇺🇸🇺🇸ECHO IF YOU STILL SUPPORT OUR PRESIDENT TRUMP!🇺🇸🇺🇸  The Democrats are determined to use everything in their power to sabotage Trump in 2020! If they are successful, you won’t be able to find these coins anymore… Which means that their price skyrocket at least 400%! Get as many of them as you can now, they will be worth a lot more soon and you will be able to profit! Please ECHO so every patriot can see! ......#WeThePeople #DonaldTrump #FightBack #Justice #trump2020 #trump #freedom #realdonaldtrump #maga #maga2020 #votered #votetrump2020 #votetrump #tomilahren #seanhannity #foxnews #parlerusa #potus #coronavirus #deplorables #deplorable #unitedstates #parler #politics #democrat #democratsaredestroyingamerica #trumppence2020 #qanon #strongertogether #unitedwestand #keepamericagreat #makeamericagreatagain",NEUTRAL,NEUTRAL
Said the very people who sold out their country to the CCP!!!Absolute DISGRACE!!!,OPINIONATED,OPINIONATED
Okinawa Flat Belly Tonic Review.Is This Diet Program Legit Or Scam?read my post: #okinawa flat belly tonic review #where can i buy okinawa flat belly tonic #where to buy okinawa flat belly tonic #parler #weightloss,NEUTRAL,OPINIONATED
Asshole commie,OPINIONATED,NEUTRAL
"Ok, let’s roll !",OPINIONATED,OPINIONATED
"The female Trump supporter known as Frankie that was illegally shot by Commmunist Police in the Capitol has died. The Halls of Congress are now stained with the blood of the innocent and SHALL be torn down. May JUSTICE be swift, and may the corrupt quake in fear...REMEMBER, REMEMBER THE 6TH OF DECEMBER",NEUTRAL,OPINIONATED
🕊God bless this beautiful women and her family 🌟,OPINIONATED,OPINIONATED
"Well spoken, John. Thank you.",OPINIONATED,OPINIONATED
Wrong!,OPINIONATED,OPINIONATED
I respected you for four years and you just lost my respect today! You have absolutely no balls,OPINIONATED,OPINIONATED
So will we !,OPINIONATED,OPINIONATED
Love this chyron!,OPINIONATED,OPINIONATED
The Patorits love you...Proud Boys are the Blood of the Patorit...God bless you...please stay safe...The Revolution has started and you and others must lead..,OPINIONATED,OPINIONATED
It’s true though,OPINIONATED,OPINIONATED
Yes. We will.,OPINIONATED,OPINIONATED
She sucks. Was never qualified. Loser,OPINIONATED,OPINIONATED
Lacrosfera em prantos agora!,NEUTRAL,NEUTRAL
For those that are naysayers I can verify that Xekta has been in the Ukraine since July 2020 and that us as far as I speak on the subjectU.S. Special Forces spotted in Ukraine.,NEUTRAL,NEUTRAL
Echo until she is removed!!,NEUTRAL,NEUTRAL
BRAND NEW TRUMP TWEET,NEUTRAL,NEUTRAL
Trying. It won’t allow me too and looking up how to on the internet shows numerous complaints where people can’t deactivate.,OPINIONATED,NEUTRAL
Make him famous!!,OPINIONATED,OPINIONATED
Mike Lindell... he knows.. Listen and be faithful and steady people ‼️,OPINIONATED,OPINIONATED
Do you need more proof the Covid19 vaccine is a depopulation programme?,OPINIONATED,OPINIONATED
Exactly!,OPINIONATED,OPINIONATED
Well that’s interesting,OPINIONATED,OPINIONATED
Fantastic interview! 2 great patriots who love this country,OPINIONATED,OPINIONATED
DEFINITELY NOT MAGA,NEUTRAL,NEUTRAL
I wanna see those docket entries! 📢📢,NEUTRAL,NEUTRAL
Insurrection act needed,NEUTRAL,NEUTRAL
This shit is ridiculous.,OPINIONATED,OPINIONATED
I have no respect for this spineless coward!,OPINIONATED,OPINIONATED
"Listening to Trump speak at the rally. I'll tell you, this is the greatest leader this country has ever had. If only there were more Patriots like him we would be unstoppable",OPINIONATED,OPINIONATED
Agree..hes gotta go.,OPINIONATED,OPINIONATED
Stopped to make votes.,NEUTRAL,OPINIONATED
"a href=""/profile/SeanSpicer/posts"" class=""at"">@SeanSpicer</a> there you go.....moron. Now resign your position",OPINIONATED,OPINIONATED
Sleep with one eye open boy your type are treasonous disgusting disgrace....all Democrats are fagots and those who defend them can get hung,OPINIONATED,OPINIONATED
There should not be a safe place for this traitor,OPINIONATED,OPINIONATED
United we stand!!🇺🇸🇺🇸,OPINIONATED,OPINIONATED
This was planned,NEUTRAL,NEUTRAL
"Two of the boxes have failed, what do you expect?",OPINIONATED,OPINIONATED
"Then it’s time to get it done, stop playing with peoples lives and futures",OPINIONATED,OPINIONATED
Good watching,OPINIONATED,OPINIONATED
finally good news,OPINIONATED,OPINIONATED
Thank You Lord🙏🏻🙏🏻🙏🏻🙏🏻,OPINIONATED,OPINIONATED
Absolutely great first move by Trump and the GOP!!,OPINIONATED,OPINIONATED
Someone needs to shove a boot up her ASS. Dems are called dimwits for a reason. Not the brightest stars in the sky.,OPINIONATED,OPINIONATED
"I never saw anything on the news, breaking news, radio reporting, the national guard being called, or even sirens when antifa & blm were destroying our country. They were stabbing and killing citizens, destroying national monuments, buildings, stores, burning stores. Now suddenly the media is all over reporting Patriots protesting in Washington. The liberals have exhausted our patience and tolerance toward their absurd vision of America. It's time!",OPINIONATED,NEUTRAL
Shriveled up ROTTEN EVIL BASTARD.,NEUTRAL,OPINIONATED
Totally AGREE 👍🇺🇸💯☝️,OPINIONATED,OPINIONATED
"Our great country is no more. Silicon Valley 💵 billionaires are promoting end of capitalism and supporting Socialism/Communism so they can have total control of our country. They’re not just CEOs of Farcebook or Google or Amazon they’re co-CEOs and co-owners of America. They couldn’t care less about the DemonRats. They just used the DemonRats as a means to the end, so they can become the ultimate powerful entity that rules this country. DemonRats just picked the right side, so they became the billionaires’ puppets while Republicans are always behind and playing catch-up. And now the Republicans are just minuscule meaningless dust particles.",NEUTRAL,OPINIONATED
#The Worst,OPINIONATED,OPINIONATED
Tipsy and traitorous,OPINIONATED,OPINIONATED
Trump just said he’s not hearing good things regarding Pence standing up & doing what’s right!,NEUTRAL,OPINIONATED
Dump Facebook.,OPINIONATED,OPINIONATED
So why are we supposed to accept that. Fraud is fraud.,OPINIONATED,NEUTRAL
Facebook is dying.,OPINIONATED,OPINIONATED
TRUMP LIVE 2020 USA FOREVER,OPINIONATED,OPINIONATED
THE GREATEST PRESIDENT IN US HISTORY🇺🇸🇺🇸🇺🇸🇺🇸🇺🇸🇺🇸🇺🇸 Took the time and turn to back and said hello,OPINIONATED,OPINIONATED
"Well, one can hope.",OPINIONATED,OPINIONATED
只有內戰才能解決左派妖孽！,NEUTRAL,NEUTRAL
Wooohoooo!!! Welcome sir!!!,OPINIONATED,OPINIONATED
Do these idiots still want to defund the police this was how stupid their idea was! We the America People need our Police Officers. We the American People care for our officers.,OPINIONATED,OPINIONATED
Fuck them all..burn it down.,OPINIONATED,OPINIONATED
"a href=""/profile/linwood/posts"" class=""at"">@linwood</a> is right!",OPINIONATED,OPINIONATED
SAY IT LOUD PROUD TINA... WE ARE THE NEW PATRIOT PARTY AND YOU ARE OUR SPOKESPERSON!!!!,OPINIONATED,OPINIONATED
That would be WAY too late. It's past that point now unfortunately. God help us.,OPINIONATED,OPINIONATED
So I guess that debate on Mike Pence being a Patriot or Traitor is over.He unfollowed Trump on twitter and changed his header photo. What is he a 14 year old girl and resorting to unfollowing people to prove a point?I hope he's the first arrest.#FuckPence #HangTraitors #1776,NEUTRAL,OPINIONATED
No surprise. Idiots,OPINIONATED,OPINIONATED
GEORGIA GOES FULL BLOWN FASCIST,OPINIONATED,NEUTRAL
This is disgusting.,OPINIONATED,OPINIONATED
"DRAG PENCE, SCHUMER, PELOSI AND MCCONNELL INTO THE STREET FOR SUMMARY TRIAL AND PUNISHMENT. THIS WILL NOT STAND.",OPINIONATED,NEUTRAL
That's right - enough is enough.,OPINIONATED,OPINIONATED
😂 God help us! We live in a world ruled by psychopathic monsters and occupied by braindead sheep. Not the best combo!,OPINIONATED,OPINIONATED
you gotta love this woman..!,OPINIONATED,OPINIONATED
I love trump.,OPINIONATED,OPINIONATED
I love these people.,OPINIONATED,OPINIONATED
We need to stop this crap! Whoever is responsible needs to pay .,OPINIONATED,OPINIONATED
"This “COWARD” is a “TOTAL” Disgrace to our country! I had no “CONFIDENCE” in him whatsoever! I thought he was going to “SURPRISED” ALL Americans by doing the “RIGHT” thing but he “ENDED” up “BETRAYING” our President which is NOT a surprise to me! I never “TRUSTED” him! I actually think he is part of the “PEDOPHILE RING!” It’s OFFICIAL, Mike Pence Has FAILED 👇",OPINIONATED,OPINIONATED
I beg Vernon Jones to please reconsider joining the Republican party. That will be a big waste of your talent. You really need to check on and investigate maybe starting your own political party. I would be honored to be one of your first members!,OPINIONATED,OPINIONATED
Things are getting interesting. I am very excited on what will be happening in the coming days.,OPINIONATED,OPINIONATED
I cannot believe what you have been thru. I am disgusted by the Republicans and have left the party TONIGHT,OPINIONATED,OPINIONATED
"Lyle BrysonThe Foundations of Free GovernmentWe hold these truths to be self-evident, that all men are created equal, that ...",NEUTRAL,NEUTRAL
#parler having all sorts of technical and network errors. The weight of the truth is crushing...,OPINIONATED,OPINIONATED
"‘Everybody dies’: Musk says neither he nor his family will take Covid-19 vaccine, blasts Bill Gates as ‘knucklehead’",OPINIONATED,OPINIONATED
Excellent,OPINIONATED,OPINIONATED
"Wow. Wow. Wow. Llin Wood, I never doubted you but things are perfectly clear now.",OPINIONATED,OPINIONATED
WOW!!!,OPINIONATED,OPINIONATED
G-D BLESS HIM,OPINIONATED,OPINIONATED
This is NOT an empty threat its the truth when Trump leaves office as he can go for marshall law and declare it then we can all kiss our sorry asses goodbye as yesterday the left already called on twitter to shoot all Trump supporters!!!!,NEUTRAL,NEUTRAL
This looks totally fake and weird,OPINIONATED,OPINIONATED
Ready willing and able,OPINIONATED,OPINIONATED
We pray you are being fair and honest. 80+ million Americans have 👀 and ears 👂🏽 out and open today. We Won this by a landslide.,OPINIONATED,OPINIONATED
Amen! Bullshit!,NEUTRAL,OPINIONATED
Brilliant,OPINIONATED,OPINIONATED
Share far and wide,OPINIONATED,OPINIONATED
"When WE scream ""F these elections"", that is NOT what we mean...",OPINIONATED,OPINIONATED
Internet is getting bad in DC,OPINIONATED,OPINIONATED
Mitch McConnell capitulating on live TV. He says that after four years of attacks from Democrats we must not return fire. Weak and spineless.,OPINIONATED,NEUTRAL
Goodnight and hope you rest well because you may not like what you see in the morning,NEUTRAL,NEUTRAL
Nancy pelosi let a congresswomen who tested positive for the China virus 6 days ago onto the house floor in order to get her vote.. But she won't let healthy Americans get back to work.,NEUTRAL,NEUTRAL
Thank you for being here,OPINIONATED,OPINIONATED
🇺🇸💗🇺🇸DC on jan 5 2021... The day before the main event... 🇺🇸💗🇺🇸,NEUTRAL,NEUTRAL
Twitter suspended the Presidents account account FUCK THEM. My mother said that as I wrote it,NEUTRAL,OPINIONATED
Thanks Chuck.,OPINIONATED,OPINIONATED
Scenes from inside the capitol building as patriots have taken it. 🇺🇸,NEUTRAL,NEUTRAL
We are PROUD of you Mr President! Thank you for Everything!,OPINIONATED,OPINIONATED
This is sickening,OPINIONATED,OPINIONATED
يمكن ترجع في صورة تانية.. يمكن..,NEUTRAL,NEUTRAL
"🇺🇸 WE 🇺🇸 THE 🇺🇸 PEOPLE 🇺🇸👁‍🗨REMEMBER Q 4949👁‍🗨“that this nation, under God, shall have a new birth of freedom and that government of the people, by the people, for the people, shall not perish from the earth.”– Abraham Lincoln Nov 1863 Together we win.Q",OPINIONATED,OPINIONATED
So true for many newcomers,OPINIONATED,OPINIONATED
"Congress is trying to cancel 80M people, LOL. Bizarre and desperate. They know they are on borrowed time.",NEUTRAL,OPINIONATED
"Well, Ted earned it well. Do it NOW.",OPINIONATED,OPINIONATED
He is a coward,OPINIONATED,OPINIONATED
Share this one far and wide.,OPINIONATED,OPINIONATED
Nations in Action Affidavit delivered,NEUTRAL,NEUTRAL
Yes I totally agree with you,OPINIONATED,OPINIONATED
"""I Am Officially Joining The Republican Party""- Georgia Democrat Vernon Jones Announces He Is Leaving The Party Welcome sir! You are a principled and honest person that I would vote for.",OPINIONATED,OPINIONATED
DC LIVE POLICE V PATRIOTS,NEUTRAL,NEUTRAL
I don’t understand why we’re still using Dominion voting machines for the Georgia election today. Makes no sense!,OPINIONATED,OPINIONATED
"“I think it will be a very bad look for the people’s House not to entertain debate”Rep. #MattGaetz said it’s not yet clear whether #SpeakerPelosi will allow House lawmakers to hold a debate or vote on objections to the #ElectionResults in some states. <a href=""/profile/Transparency2020/posts"" class=""at"">@Transparency2020</a> #Transparency2020",OPINIONATED,OPINIONATED
It’s FLU,OPINIONATED,OPINIONATED
"This video is not yet getting the echoes it deserves. Nurses all around our beautiful country are against the lockdowns and vaccines chanting masks make us sclaves and vaccines kill us, even in the face of corrupt police. Give a big echo and do justice",NEUTRAL,NEUTRAL
This is just like the Nazi Reichstag staged burning...too predictable a ready made story for the real tyrants take even more control. This is not the Trump base....,OPINIONATED,OPINIONATED
Horrible. Abortion is murder and its moraly wrong.,OPINIONATED,OPINIONATED
Total idiot!!!!,OPINIONATED,OPINIONATED
Proud to stand with my President and the real Americans who love this country.,OPINIONATED,OPINIONATED
Breaking:They Want Ted Cruz To Be Arrested Over Election Audit- He Responded With Big Statment,NEUTRAL,OPINIONATED
MERICA......LOVE LOVE LOVE THIS!!!!!,OPINIONATED,OPINIONATED
Agree but good luck with that,OPINIONATED,OPINIONATED
