text,s_palak_label,s_ben_label
This is what gives me hope for America!,OPINIONATED,OPINIONATED
"Remember people, they are laws to prevent this kind is crap: The Smith Act of 1940 made it a criminal offense for anyone to knowingly or willfully advocate, abet, advise, or teach the duty, necessity, desirability, or propriety of overthrowing the Government of the United States or of any State by force or violence, or for anyone to organize any association which teaches, advises, or encourages such an overthrow, or for anyone to become a member of or to affiliate with any such association.Again, violence is not the answer (unless you’re the left, an alphabet group member, brown and white people lives don’t matter or as you know them, BLM.Someone has already been shot for this stupid action, stop now.",OPINIONATED,OPINIONATED
Ibet that truth means nothing!,OPINIONATED,OPINIONATED
A TRUE PATRIOT WITH GUTS AND LOYALTY TO GOD COUNTRY AND CONSTITUTION!! GOD BLESS HIM AND PROTECT HIM !!,OPINIONATED,OPINIONATED
💯💯💯💯💯💯💯💯💯Light his sorry ass up......#wwg1wga,OPINIONATED,OPINIONATED
He can paint his face to disguise his identity. Not smart enough to realize tats are tattle tails.,OPINIONATED,OPINIONATED
"To Senator Cruz, thank you for staying strong! You of all people know the US constitution and have tried to do the right thing. Greatness takes doing what is right even if it is not popular.",OPINIONATED,OPINIONATED
Not surprising!,OPINIONATED,OPINIONATED
\My spouse and I are very proud Trump voters.,OPINIONATED,OPINIONATED
Just saying 🙃,NEUTRAL,NEUTRAL
Oh the News Media are making out like this was the worst thing ever. During the Democrat -China led Pandemic look at the burning of private business and City own Tax paid police vehicles and the bricks that were deliver and place on the streets. The Democrats spendt a lot of our tax dollars organizing these deadly riots.,OPINIONATED,OPINIONATED
"Shit... that’s Patriots too at the moment, everyone losing their shot over shit NONE CAN CONFIRM NOR DENY.",NEUTRAL,OPINIONATED
An absolute must watch tonight!!! Please watch and share Patriots! We are going to win! God Bless you all and God Bless America!!! 🇺🇸🇺🇸🇺🇸,OPINIONATED,OPINIONATED
WTAF? Ridiculous.,OPINIONATED,OPINIONATED
Happy Wednesday everyone!!,OPINIONATED,OPINIONATED
CCP,NEUTRAL,NEUTRAL
This election should have been postponed we know the machines flip votes why were they used,OPINIONATED,OPINIONATED
Thanks to these brave souls...now where’s the rest of em 🤨,OPINIONATED,OPINIONATED
The Ho got paid enough to open her side business. Let’s destroy it!,OPINIONATED,OPINIONATED
Maybe if we give Stacey Abrams a couple of fast food gift cards she'll give us a FAIR ELECTION. SCREW HER.,OPINIONATED,OPINIONATED
You will not be forgotten Patriot!,OPINIONATED,OPINIONATED
"May God continue to bless you, your family and our great country.",OPINIONATED,OPINIONATED
Interesting how quickly the crime scene is no longer a crime scene. Sanitized for China virus in the entire people’s house. Why don’t we know about the officer that shot and KILLED an unarmed woman. Why are we not outraged and threatening to defund police????? More questions than answers. This stinks badly,OPINIONATED,OPINIONATED
"Thank you for your service, Patriots! God bless your journey. God bless the USA!God bless President Trump.",OPINIONATED,OPINIONATED
I am!!,OPINIONATED,OPINIONATED
"Disappointed, though I still respect him as a godly man",OPINIONATED,NEUTRAL
"That is a ton of hand typed data for a hoax or larp. We know the operation is real, no reason to put that much effort into a fake story just to try and make us look silly",OPINIONATED,OPINIONATED
Everyone get your ass to the Cogress now. They are certifying the votes now. We need pressure there. Its up to us. Echo big,NEUTRAL,NEUTRAL
This is pretty accurate,OPINIONATED,OPINIONATED
Scumbag traitor,OPINIONATED,OPINIONATED
So the mayor shuts down the hotels and restaurants and then sets a curfew and now when the Trump have no where to go the cops attack them? That's just wrong especially when they are doing absolutely wrong!,NEUTRAL,OPINIONATED
I can,OPINIONATED,OPINIONATED
PIPE BOMBS AT THE RNC???Yes sounds very ANTIFA like doesn’t it???Swipe picture left,OPINIONATED,OPINIONATED
"Is your Senator a freedom fighter like <a href=""/profile/KLoeffler/posts"" class=""at"">@KLoeffler</a>? Remind your Senator/House Member of the oath they took for YOUR freedom.",NEUTRAL,NEUTRAL
Excellent Now pick up that gavel and announce Donald j Trump as president of these United StatesSo say us all!,OPINIONATED,OPINIONATED
Very sweet. Thanks for sharing it.,OPINIONATED,OPINIONATED
EXCELLENT JOB BOYS!!!! 🙌🏻👏🏻👏🏻👏🏻,OPINIONATED,OPINIONATED
BO wasn’t a 10th the man you are sir! Welcome and thanks for standing up for America and the constitution!,OPINIONATED,OPINIONATED
At this point this country is a shit show so how much worse could it get?,OPINIONATED,OPINIONATED
"We have a constitutional right to carry a firearm. We won’t allow you to prevent us from carrying them. FYI, the hundreds of thousands of patriots in DC right now have more firearms on them than all of law enforcement and military in DC. You do know that, right?! 🇺🇸",NEUTRAL,NEUTRAL
You've got to see this,OPINIONATED,OPINIONATED
Amazing how cops allow that kind of staging.,OPINIONATED,OPINIONATED
A beautiful moment in time I will never forget.,OPINIONATED,OPINIONATED
Worth the time,OPINIONATED,OPINIONATED
"WHILE YOU ARE DENIED VISITING YOUR COVID 19 DYING RELATIVES THESE SCUM DANCE TO THE BEAT OF THE FAKE KUNG FLU ELECTION FRAUD IF YOU DONT GET THEY ARE IN ON IT, YOU ARE AS STUPID AS YOU LOOK",OPINIONATED,OPINIONATED
"I’m with you, Judge",OPINIONATED,OPINIONATED
Beware of following in the same direction of any crowd. People are stupid.,OPINIONATED,OPINIONATED
God Bless!,OPINIONATED,OPINIONATED
Crooked sonofabitchs need held for election fraud tampering whatever you want to call it but it’s wrong,OPINIONATED,NEUTRAL
Out you go!,OPINIONATED,OPINIONATED
Kamalamala is nothing but a scummy whore.,OPINIONATED,OPINIONATED
Communist have taken over DC! How pathetic what our nation's capital has turned into thanks to the DemoRats and RINOs.,OPINIONATED,OPINIONATED
He's not Worth commenting on.,OPINIONATED,OPINIONATED
True Patriots!,OPINIONATED,OPINIONATED
Thank you Mr. Rock,OPINIONATED,OPINIONATED
Amen with this Kevin and I totally agree. You need an ID for everything. When I buy a bottle of wine I need my ID. I’m not an alcoholic Kevin but a glass of wine before bed is my Prozac. I’m 78 and take no prescription drugs except aspirin and a glass of wine is a blessing. God bless you and president Trump and keep up your great work. Love your movies.,OPINIONATED,OPINIONATED
D.C. Roads Shut Down Ahead Of Massive Gathering Of Patriots!,NEUTRAL,OPINIONATED
Will do!!,OPINIONATED,OPINIONATED
Lol that’s funny,OPINIONATED,OPINIONATED
"Dementia Joe and Kamala HO, what bad jokes!!",OPINIONATED,OPINIONATED
I will be there thanks.,OPINIONATED,OPINIONATED
Please pass it on and help reunite her with her family. Thank you!,OPINIONATED,OPINIONATED
"6978 🔴LIVE: Trump Supporters Converge on Washington, DC at Freedom Plaza",NEUTRAL,NEUTRAL
"SKETCHY: CNN and ABC News Remove 5,000 Perdue Votes During Live Broadcasts (VIDEOS) Nothing to see here!",OPINIONATED,OPINIONATED
OUTSTANDING!!!!CA is RED all the way!!!,OPINIONATED,OPINIONATED
"My Florida patriots , both Rubio and Scott voted against the President. Let show them the road at the next election",NEUTRAL,NEUTRAL
Gets my vote,OPINIONATED,OPINIONATED
WE no longer recognize DC as a legitimate governing authorityJust criminal traitors....🖕 and ALL your decrees 🖕,OPINIONATED,NEUTRAL
Betrayed!!!,OPINIONATED,OPINIONATED
Very important Patriots. President Trump has very good options at hand!,OPINIONATED,OPINIONATED
"No fraud by democrats, just republican fraud like gerrymandering that isn't working.",OPINIONATED,NEUTRAL
Now that’s funny right there.,OPINIONATED,OPINIONATED
Love it In Jesus’s name,OPINIONATED,OPINIONATED
Absolutely true brother!,OPINIONATED,OPINIONATED
"COPIED.... A TRUE STATEMENTIf Joe Biden is allowed to win the election with a flood of late ballots, backdated ballots, computer ‘glitches’ and votes from dead people and actual becomes President of the United States, millions of Americans will rightly feel that their democratic birthright has been stolen.That is a situation that will not end well......",OPINIONATED,OPINIONATED
This is everything,OPINIONATED,OPINIONATED
Good point!,OPINIONATED,OPINIONATED
Governo bloqueia Bolsa Família de doadores nas eleições 2020 - Notícias - R7 Brasil,NEUTRAL,NEUTRAL
Sleep.,OPINIONATED,OPINIONATED
McConnell by not admitting their was voter fraud you were dumb enough to let it happen again to get yourself booted from your position. What a disgrace.,OPINIONATED,OPINIONATED
"If you are able, you need to be watching this RIGHT NOW. TRUMP will be addressing America LIVE from the Save America Rally.#RSBN #Trump2020 #Jan6",NEUTRAL,NEUTRAL
#GodFirst #Devotions #Finances2,NEUTRAL,OPINIONATED
I love the lion,OPINIONATED,OPINIONATED
Echo please and share everywhere!,OPINIONATED,OPINIONATED
"Propaganda Media, more biased and tainted then ever, so obvious that even a blind Man can see it!We need a list of the King Pins behind all of this!",OPINIONATED,OPINIONATED
"Mr. President  @Name Hidden  the men & women of law enforcement are under assault. It is crucial you help restore order by sending resources to assist the police and ask those doing this to stand down.&mdash; Marco Rubio (@marcorubio) January 6, 2021 #MAGA #transparency2020 #electionfraud #electionintegrity#Trump #2020election #AmericaFirst#senate #House #congress #electoralcollege",NEUTRAL,OPINIONATED
LOVE this woman!,OPINIONATED,OPINIONATED
At The Highest Levels – Part 1 of 3 – Neon Revolt,NEUTRAL,NEUTRAL
Bullshit what an asshole,OPINIONATED,OPINIONATED
Well done Fellow Patriots. Thank you. Stay safe out there. 👍👍👍👍👍👍🇺🇸🇺🇸🇺🇸🇺🇸🇺🇸🇺🇸,OPINIONATED,OPINIONATED
AWESOMENESS!!!,OPINIONATED,OPINIONATED
"The dumbest people on the internet, or just the average Parler account. #wwg1wga",OPINIONATED,OPINIONATED
Thank you! Beautiful To See!,OPINIONATED,OPINIONATED
Traitor.,OPINIONATED,OPINIONATED
OH MY GOODNESS! DOMINION TRIED TO SHUT DOWN AND CHEAT AGAIN! ANOTHER 1HOUR GLITCH? ANOTHER PIPE BURST? HURRY....RUN AND GET FAKE BALLOTS! UH OH...NO GERMANY....,NEUTRAL,OPINIONATED
I do agree,OPINIONATED,OPINIONATED
Welcome Home!,OPINIONATED,OPINIONATED
Great speech.,OPINIONATED,OPINIONATED
"Our voices are being snuffed out by fraud and corruption at the ballot boxes, and by censorship and lies from big tech and the media. We MUST find another way to make our voices count!",OPINIONATED,NEUTRAL
Real PatriotsSen. Ted CruzSen. Josh HawleySen. Cindy Hyde-SmithSen. Roger MarshallSen. John Kennedy Sen. Tommy Tuberville,NEUTRAL,NEUTRAL
Patriots catch Mitt Romney on their way to DC and … UNLEASH ON HIM!BEST VIDEO OF THE DAY...,OPINIONATED,OPINIONATED
Keep America Great!!!,OPINIONATED,OPINIONATED
who in their right mind thinks this is actually for the betterment of the child? #BornPerfect I DO NOT CONSENT 🚫☠️💉,OPINIONATED,NEUTRAL
Make her famous,OPINIONATED,OPINIONATED
"At the Highest Levels – Part 3 of 3 – Neon Revolt💠💠💠💠💠💠💠💠💠This is what’s happening now. This is where we are at – with a man closest to the President, who – according to our whistleblower – secretly agreed to participate in a coup against that very same President, set to determine the fate of that same President, by getting to decide which slates of electors get counted in this, the most fraudulent election to ever take place in the history of this country.",NEUTRAL,NEUTRAL
God the father of my Lord Jesus Christ gives unto me the spirit of wisdom & revelation & my eyes are enlightened that I may know the hope of the glory of His inheritance in me & the exceeding greatness of His power that flows through me Eph. 1:17-19,OPINIONATED,OPINIONATED
I don't know how to upload a video,OPINIONATED,OPINIONATED
"Nothing to see here, move along...",OPINIONATED,OPINIONATED
The Supreme Court is responsible for this tragedy today. All they had to do was their job. All they had to do is tell these states that it is unconstitutional to go around federal voting laws. This could have been done before the election. They saw what was happening. Instead they chose to turn a blind eye to all the fraud that was so obvious. Then they chose to not here any case brought before them. They left millions of Americans with no hope even in our justice system. Instead what is the media and most of our politicians doing now. Blaming Trump. This could have all been avoided. Simply by following the law.,OPINIONATED,OPINIONATED
"We may have been played! They are saying that it was antifa that stormed the capital and started the confrontation, done to make Trump look bad!!!",NEUTRAL,OPINIONATED
It’s magic,OPINIONATED,OPINIONATED
Tapper is scum in the mightiest sense of the word!,OPINIONATED,OPINIONATED
My President!,OPINIONATED,OPINIONATED
Sick bastard,OPINIONATED,OPINIONATED
Events Leading Up To Todays Unrest In Washington D.C.,NEUTRAL,NEUTRAL
"Dr Jill FYI , your not a real doctor!",OPINIONATED,OPINIONATED
Excellent commentary from our fearless President Trump.,OPINIONATED,OPINIONATED
Congress has reconvened and our LIVE coverage is back online.WATCH NOW:,NEUTRAL,NEUTRAL
I'm sorry. At the end there...You misspelled TREASON❗❗...,OPINIONATED,OPINIONATED
What about their “Civic Duty” when THEY WERE SPREADING LIES ABOUT TRUMP ‼️‼️‼️‼️AND THEY NEVER CONDEMNED A ANTIFA/BLM THUGS POST‼️‼️‼️‼️‼️,NEUTRAL,NEUTRAL
"Twitter just freeze his account, what the hecks is going on. Enemy is trying to block all the communication at this time brace your self.",OPINIONATED,OPINIONATED
FINISHED! We are the TRUMP REPUBLICAN PARTY now and we are proud of our country!🇺🇸AMERICA FIRST,OPINIONATED,OPINIONATED
"Newsmax; “very frustrating” number of “outstanding votes” from DeKalb Co. GA just went “from 130,000 to 170,000”It’s coming folks. Keep your eyes peeled!",NEUTRAL,NEUTRAL
Unbelievable....it just gets worse!,OPINIONATED,OPINIONATED
One dead in WashingtonThe women who was shot in the capital has died. We need to determine who shot her and if he was Antifa or BLM so we can have them officially labeled as a Terrorist Org and have them all arrested on federal charges.,OPINIONATED,OPINIONATED
We are losing our country day by day.,OPINIONATED,OPINIONATED
NY Times is FAKE NEWS!! #failingnytimes #nytimesfakenews,OPINIONATED,OPINIONATED
EXACTLY EXACTLY EXACTLY!!!!!,OPINIONATED,OPINIONATED
"I’m glad I wrote in Trump for both Senate seats. If they won’t stand up for Trump then I won’t fight for fake RINOs. Maybe next time we can get a REAL conservative like my awesome new Rep <a href=""/profile/RealMarjorieGreene/posts"" class=""at"">@RealMarjorieGreene</a> #georgiarunoff #georgia #stopthesteal",NEUTRAL,NEUTRAL
This is war...,OPINIONATED,OPINIONATED
"MY GOD, IT'S ALL REALLY HAPPENING RIGHT NOW!! THIS IS AMAZING.",OPINIONATED,OPINIONATED
The Swamp and Deep State will soon be back in control to advance NWO! Don't seem like too many were indicted or convicted!,NEUTRAL,NEUTRAL
This is the inevitable result when you allow an election to be stolen in plain view.,NEUTRAL,OPINIONATED
Thank you for your service!🇺🇸,OPINIONATED,OPINIONATED
Georgia vote integrity hit by fresh failure of Dominion voting machines,NEUTRAL,OPINIONATED
I’ll bet it’s closer to 2/3,NEUTRAL,NEUTRAL
Ha ha. You’re right. Especially the policeman.,OPINIONATED,OPINIONATED
Totally agree!,OPINIONATED,OPINIONATED
The honor this man has brought to the average American is incredible..He is a Warrior for the People and sent by God..We are blessed to have this man champion the People...GOD BLESS PRESIDENT TRUMP..,OPINIONATED,OPINIONATED
How Great is Our God,OPINIONATED,OPINIONATED
Just got my FREE MAGA hat. I love it! I recommend it to every Proud Trump Supporter. It’s an honor to have it and it shows my support for the man who FOREVER changed our country for the better!Upvote if Donald Trump is still your PRESIDENT🇺🇸 He never quits! He never backs down! He believes in you!,OPINIONATED,OPINIONATED
🚨 🚨 alert 🚨 🚨 🚨 🚨 Georgia caught again cheating and they already call the race. I do not think so. Fucking scumbags or ruining our country by spraying and Erasing tens of thousands of votes for our Republican candidates just cannot stand.,OPINIONATED,OPINIONATED
A disgrace,OPINIONATED,OPINIONATED
Ok this is funny!,OPINIONATED,OPINIONATED
Republicans are folding like a bad poker hand. No surprise that they went back on their word.,OPINIONATED,OPINIONATED
Live streams of Congress just went down......,NEUTRAL,OPINIONATED
This Awesomeness in a SUIT👇🏼Smartest Man 💋💋💋💋I Know ✍️✍️✍️🙏🙏🙏🙏My President 💃🏻🇺🇸✌🏼💃🏻💯🇺🇸💋💋💋💋 Baby💋🇺🇸✌🏼💋💋💋,OPINIONATED,OPINIONATED
Of course it does! The Globalists’ plan is coming together perfectly.,OPINIONATED,OPINIONATED
True Colora,OPINIONATED,OPINIONATED
BREAKING:THE SIGNED AFFIDAVIT FROM THE GENTLEMAN THAT WAS RESPONSIBLE FOR SWITCHING VOTES FROM DONALD TRUMP TO JOE BIDEN...THIS IS THE MISSING PIECE OF EVIDENCE THAT SIDNEY POWELL & LIN WOOD WERE LOOKING FOR......,OPINIONATED,OPINIONATED
Not 1 fucking senator signed ! what cowards this is a bad Steven king movie !,OPINIONATED,OPINIONATED
YES!!!,OPINIONATED,OPINIONATED
Stop! Violence in any form is unacceptable. This hurts our cause .Free speech and peaceful protest yes ; violence absolutely not,OPINIONATED,OPINIONATED
This is awesome!!! 🇺🇸❤🤍💙,OPINIONATED,OPINIONATED
Seriously! They were welcomed in!,OPINIONATED,OPINIONATED
"These assholes HATE each and every one of you!! They don't care if you DIE a terrible, horrible DEATH!!THIS IS A FACT!!",OPINIONATED,OPINIONATED
"Echo, Echo, Echo !!This thing is not human.",OPINIONATED,OPINIONATED
HoweLeeShit!,NEUTRAL,NEUTRAL
PATRIOTS,NEUTRAL,NEUTRAL
"We the people need for everyone at the U.S. Capitol to keep at peace. need no violence! Remember, we are the Party of Law & Order, respect the Law and our great men and women in Blue.",OPINIONATED,OPINIONATED
All the BLM and ANTIFA imposters will be identified and dealt with.,NEUTRAL,NEUTRAL
"Here Georgia Senator David Perdue loses another 50,000 votes to Dominion-Smartmatic electronic thievery on camera:",OPINIONATED,OPINIONATED
"Dr. Larry Palevsky, PediatricianFull Testimony Connecticut 2/19/2020",NEUTRAL,NEUTRAL
"#SteveBannon: Kevin McCarthy should be fired for failing to do his job, getting only 36 votes in 6 #battlegroundstatesWe're taking names#WarRoomPandemic <a href=""/profile/WarRoom2020/posts"" class=""at"">@WarRoom2020</a> #electionnight #stopthesteal",OPINIONATED,OPINIONATED
Bastards,OPINIONATED,OPINIONATED
Fraude,NEUTRAL,OPINIONATED
All I want to know is can we fire the GOP chairwoman now??,OPINIONATED,OPINIONATED
The national guard and other federal services are on the way. You have attempted a coup. This will not end well. And Biden will still be confirmed. You fucking morons.,OPINIONATED,NEUTRAL
Thing starting to sound like something’s wrong somewhere 🇺🇸,OPINIONATED,OPINIONATED
Well deserved!!! 🇺🇸💪💥‼️🇺🇸,OPINIONATED,OPINIONATED
Thank you. Prayers for strength and safety 🙏🏻🙏🏻🙏🏻,OPINIONATED,OPINIONATED
True Patriot who will be remembered just like the students of Kent State,OPINIONATED,OPINIONATED
That looks way too much like Antifa for my liking.,OPINIONATED,OPINIONATED
RIGGED,OPINIONATED,NEUTRAL
It's all bullshit democratic bullshit,OPINIONATED,NEUTRAL
Good point,OPINIONATED,OPINIONATED
Deep State wins again!,OPINIONATED,OPINIONATED
"Cruz, Hawley, Hyde-Smith, Kennedy, Marshall, Tuberville.... PATRIOTS🇺🇲🇺🇲🇺🇲🇺🇲🇺🇲🇺🇲🇺🇲🇺🇲",NEUTRAL,NEUTRAL
Fraud explains negative votes.,OPINIONATED,OPINIONATED
Too stupid to change his costume...,OPINIONATED,OPINIONATED
IS THIS THE NEW SHOT HEARD ROUND THE WORLD?,NEUTRAL,NEUTRAL
The Jewish rulers of America are starting their propaganda against #Whites already. It will get worse:,OPINIONATED,OPINIONATED
True !!!!!,OPINIONATED,OPINIONATED
Thank you to each and everyone of you too !!,OPINIONATED,OPINIONATED
Love you Candace!,OPINIONATED,OPINIONATED
Our Citizens have chosen their Constitutional Right to shut down our government ... send all representatives home without pay or pension to suffer as our representatives have chosen to make our citizens suffer. Those outside their house of Congress are hre because you made them unable to earn a living with your shutdown & now their homes are in foreclosure ... you brought this on yourself ... per our citizens Constitutional Right ... you are fired.,OPINIONATED,OPINIONATED
Sickening,OPINIONATED,OPINIONATED
#HOLDTHELINE more info is coming out - it was a set up!,NEUTRAL,NEUTRAL
Is this true,OPINIONATED,OPINIONATED
"Something cool totally non-political.1948, my dad‘s 11th birthday. ❤️❤️❤️",OPINIONATED,OPINIONATED
Idiot idiot and idiot,OPINIONATED,OPINIONATED
"Trump has fucking lost. Accept reality and get on with your pitiful embarrassing lives. The cult is over, live with the shame for a while, then start being nice to your black neighbours again. Turn your hate filled lives into happy ones.",NEUTRAL,NEUTRAL
BREAKING: Patriots Have Stormed the Capitol Building — Masses Breaching Federal Barriers — Cops Losing Control (VIDEOS)BRAVO !!!!!!!!!!!!!!!!!!!!!!!!!!!!!!!!!!!!!!!!!!!!!!!!!,NEUTRAL,NEUTRAL
He's right.,OPINIONATED,OPINIONATED
"a href=""/profile/HughHewitt/posts"" class=""at"">@HughHewitt</a> You maybe a lot of things but never knew deaf dumb and blind were part of your weaknesses? I am exactly your age and remember the past as u put it. What if 75 million Trumpers stop voting? Clean what up in 4 years? Won’t be anything to clean up! I’m done voting and have all my life! Done! And done listening to pundits! U are lost!",OPINIONATED,OPINIONATED
Il leur est arrivé de trouver 50 000 bulletins de vote tard hier soir. Les États-Unis sont gênés par les imbéciles. Notre processus électoral est pire que celui des pays du tiers monde!,NEUTRAL,NEUTRAL
"Reuters #YouTube channel already blocking the Big Blue Dump from being spotted with a ""random"" update window...",OPINIONATED,OPINIONATED
👀👀 Nothing to see here!! 👀👀,OPINIONATED,OPINIONATED
I am so proud of every Patriot in DC today,OPINIONATED,OPINIONATED
Don’t let us down!,OPINIONATED,OPINIONATED
Just got my Trump Coin! I recommend it to every Proud American! It's free! Echo & Upvote if you still support our President,OPINIONATED,OPINIONATED
Absolutely correct!!,OPINIONATED,OPINIONATED
"Bitch McCuckle, like the underhanded scumbag he's always been, wants to blame the loss of the Georgia senate races on Donald Trump and the people who so much as tacitly support him. This meek, spineless jackass is actually stupid enough to think that the president with the single highest in-party approval rate in history is somehow to blame for the Republican party losing control.And he's right. Well, half right. Trump did cause the Republican party to lose control, and he did it by wrenching the power away from the pitifully weak Neocon base that we've all grown to loathe right alongside the duplicitous Neolibs.McCuckle wants to deflect blame from his own weakness and failings as a politician, a man, and a human being. We can see you for what you are, McCuckle. You and all your Neocon buddies. The Emperor's clothes are long gone, and with diligence and hard work on the part of the populists the time of this rotten establishment will at last be up.",NEUTRAL,NEUTRAL
"a href=""/profile/Stinchfield1776/posts"" class=""at"">@Stinchfield1776</a> | Here we go. The weasel <a href=""/profile/Gabrielsterling/posts"" class=""at"">@Gabrielsterling</a> just said... error in Dekalb... not 117k votes outstanding. 170k outstanding. How freaking convenient! What a scam.",OPINIONATED,NEUTRAL
The dominoes are starting to fall..,NEUTRAL,OPINIONATED
"Biden was the most rattled by the CLASSLESSNESS of the protests. Remember how he made a point of saying ""rifling through drawers."" It's the lack of propriety he can't stand. (When it's from Republicans, anyway.) He says it's murky and dirty and gross and then pivots to talking about the ""majesty"" of the democratic process. He's most offended by the fact that these are working-class people, unlike his favorite, college-educated BLM and Antifa terrorists. This isn't right on left. It's class war.",NEUTRAL,OPINIONATED
Beautiful .. God is good,OPINIONATED,OPINIONATED
"a href=""/profile/linwood/posts"" class=""at"">@linwood</a> You posted this buddy.., For the sake of my sanity as I listen to these “certification hearings” and COMPLETE lack of backbone from our Senators to not sign onto any additional states is sick. @tedcruz Could have signed all of those objectionsI need to know if Trump is ready to round these traitors up!They HAVE NOT UPHELD THEIR OATH! @genflynnI TOOK THE OATH! DID’T THEY?",OPINIONATED,NEUTRAL
#Facebook deletes 1.7 million member group ‘Joe Biden is not my President!’ with No Warnning or explanation #Censorshi,OPINIONATED,OPINIONATED
Yes you do 🙏🇺🇸😂🇺🇸. Thank you for fighting,OPINIONATED,OPINIONATED
